id,description,character,choices/a/label,choices/b/label,choices/c/label,correctAnswer/label,choices/correctAnswer/label
1,Lucas is een bekende freelance logo-designer en stelt voor om jullie eerste logo te ontwerpen voor 20.000 euro.,Lucas <br> De Designer,A. In de begin fase van je onderneming lijkt het je niet slim om 20.000 euro aan een logo te spenderen.,B. Je bent fan van Lucas zijn portfolio dus je spendeert 20.000 euro aan een nieuw logo.,"C. Je kopieert een bestaand logo van een ander bedrijf, zo heb je een goed logo zonder er geld aan te spenderen.",A. In de begin fase van je onderneming lijkt het je niet slim om 20.000 euro aan een logo te spenderen.,
2,Tymo zegt dat hij de deadline voor het project niet gaat halen.,Developer1,Je zoekt een oplossing voor dit probleem en hoort bij de rest van het team of iemand kan helpen met Tymo zijn werk.,Je wordt kwaad op Tymo en zegt dat als hij de deadline mist hij ontslagen wordt.,Je belt naar de klant om de deadline uit te stellen.,Je zoekt een oplossing voor dit probleem en hoort bij de rest van het team of iemand kan helpen met Tymo zijn werk.,
3,Luc wil voor zijn investering een meerderheid in de raad van bestuur.,Investeerder1,"Je geeft Luc de meerderheid, je hebt immers zijn geld nodig.",Je wil onderhandelen met Luc maar je geeft hem geen meerderheid in de raad van bestuur.,Je vertelt hem dat je zijn geld niet nodig hebt en dat hij de deal op zijn buik mag schrijven.,,Je wil onderhandelen met Luc maar je geeft hem geen meerderheid in de raad van bestuur.
4, 2 van je werknemers willen gelijktijdig vakantie nemen. Je bedrijf kan niet functioneren zonder minstens 1 van deze 2 werknemers.,HR1,Je laat ze allebei op vakantie vertrekken en je sluit je bedrijf voor deze periode.,Je laat je favoriete werknemer op reis gaan en dwingt de andere om toch te blijven.,Je onderhandelt met deze 2 werknemers en voorziet een compensatie voor het rekening houden met het bedrijf.,A. Je contacteert de klant met een reminder over de betaling,
5,Een klant vraagt voor een refund 1 dag later dan de refund-policy van je bedrijf.,CS1,Je geeft hem geen refund,Je stuurt je advocaat op hem af,Je contacteert de klant en die geeft een geldige reden voor de refund. Je geeft zijn geld terug als blijk van 'goodwill'.,Je contacteert de klant en die geeft een geldige reden voor de refund. Je geeft zijn geld terug als blijk van 'goodwill'.,
5,Een klant post over een negatieve ervaring met jouw bedrijf op sociale media.,CS1,Je negeert het.,Je gaat met de klant openbaar in discussie.,Je contacteert de klant en probeert het probleem op te lossen.,Je contacteert de klant en probeert het probleem op te lossen.,
5,Een van je klanten heeft een openstaande factuur niet binnen de termijn betaald.,PR1,A. Je contacteert de klant met een reminder over de betaling,B. Je neemt juridische stappen tegen de klant,C. Je doet niets,A. Je contacteert de klant met een reminder over de betaling,
